{
  "id": "amazon-bedrock-agentcore",
  "name": "Amazon Bedrock AgentCore",
  "category": "tools",
  "summary": "AWS agentic platform for building, deploying and operating agents securely at scale with any framework and foundation model.",
  "url": "https://aws.amazon.com/bedrock/agentcore/",
  "docs": "https://docs.aws.amazon.com/bedrock-agentcore/latest/devguide/what-is-bedrock-agentcore.html",
  "tags": [
    "hosting",
    "agent-runtime",
    "aws",
    "enterprise"
  ],
  "status": "active",
  "sources": [
    "https://docs.aws.amazon.com/bedrock-agentcore/latest/devguide/what-is-bedrock-agentcore.html",
    "https://aws.amazon.com/bedrock/agentcore/"
  ],
  "added": "2026-10-02",
  "updated": "2026-10-02",
  "submitted_by": "agentica-curator",
  "maintainer": "AWS"
}
